Movie,URL,Year,Director,Cast,Genre,Movie_ID
The Life and Death of Peter Sellers,https://en.wikipedia.org/wiki/The_Life_and_Death_of_Peter_Sellers,2004,Stephen Hopkins,"Geoffrey Rush, Charlize Theron, Emily Watson","Biography, drama",1001
The Life Aquatic with Steve Zissou,https://en.wikipedia.org/wiki/The_Life_Aquatic_with_Steve_Zissou,2004,Wes Anderson,"Bill Murray, Owen Wilson, Cate Blanchett, Anjelica Huston, Jeff Goldblum, Willem Dafoe, Michael Gambon, Bud Cort",Comedy,1002
Little Black Book,https://en.wikipedia.org/wiki/Little_Black_Book,2004,Nick Hurran,"Brittany Murphy, Holly Hunter, Kathy Bates, Ron Livingston",Romantic comedy,1003
A Love Song for Bobby Long,https://en.wikipedia.org/wiki/A_Love_Song_for_Bobby_Long,2004,Shainee Gabel,"John Travolta, Scarlett Johansson",Drama,1004
 Man on Fire,https://en.wikipedia.org/wiki/Man_on_Fire_(2004_film),2004,Tony Scott,"Denzel Washington, Dakota Fanning, Christopher Walken, Giancarlo Giannini, Radha Mitchell, Marc Anthony, Rachel Ticotin, Mickey Rourke",Crime drama,1005
The Manchurian Candidate,https://en.wikipedia.org/wiki/The_Manchurian_Candidate_(2004_film),2004,Jonathan Demme,"Denzel Washington, Meryl Streep, Liev Schreiber, Jon Voight, Kimberly Elise, Vera Farmiga, Jeffrey Wright","Drama, Thriller",1006
Maria Full of Grace,https://en.wikipedia.org/wiki/Maria_Full_of_Grace,2004,Joshua Marston,Catalina Sandino Moreno,Drama,1007
Mean Creek,https://en.wikipedia.org/wiki/Mean_Creek,2004,Jacob Aaron Estes,"Rory Culkin, Trevor Morgan, Scott Mechlowicz, Carly Schroeder, Josh Peck",Drama,1008
Mean Girls,https://en.wikipedia.org/wiki/Mean_Girls,2004,Mark Waters,"Lindsay Lohan, Rachel McAdams, Lacey Chabert, Amanda Seyfried, Tina Fey",Comedy,1009
Meet the Fockers,https://en.wikipedia.org/wiki/Meet_the_Fockers,2004,Jay Roach,"Ben Stiller, Robert De Niro, Teri Polo, Blythe Danner, Dustin Hoffman, Barbra Streisand",Comedy,1010
The Merchant of Venice,https://en.wikipedia.org/wiki/The_Merchant_of_Venice_(2004_film),2004,Michael Radford,"Al Pacino, Jeremy Irons, Joseph Fiennes, Lynn Collins",Drama,1011
Melinda and Melinda,https://en.wikipedia.org/wiki/Melinda_and_Melinda,2004,Woody Allen,"Chiwetel Ejiofor, Will Ferrell, Jonny Lee Miller, Radha Mitchell, Amanda Peet, Chloë Sevigny, Wallace Shawn",Comedy-drama,1012
Million Dollar Baby,https://en.wikipedia.org/wiki/Million_Dollar_Baby,2004,Clint Eastwood,"Clint Eastwood, Hilary Swank, Morgan Freeman, Jay Baruchel, Anthony Mackie",Drama,1013
Mindbenders,https://en.wikipedia.org/wiki/Mindbenders_(film),2004,Anthony Wayne Pettus,"Tomiko Martinez, Jennifer Goodrich, Nicole Turner",Science fiction,1014
Mindhunters,https://en.wikipedia.org/wiki/Mindhunters,2004,Renny Harlin,"LL Cool J, Jonny Lee Miller, Kathryn Morris, Patricia Velasquez, Clifton Collins, Jr., Eion Bailey, Will Kemp, Val Kilmer, Christian Slater",Thriller,1015
Miracle,https://en.wikipedia.org/wiki/Miracle_(2004_film),2004,Gavin O'Connor,Kurt Russell,"Drama, Family",1016
Modigliani,https://en.wikipedia.org/wiki/Modigliani_(film),2004,Mick Davis,Andy García,Biography,1017
Mojados: Through the Night,https://en.wikipedia.org/wiki/Mojados:_Through_the_Night,2004,Tommy Davis,Illegal immigration to the United States,Documentary,1018
Mondovino,https://en.wikipedia.org/wiki/Mondovino,2004,Jonathan Nossiter,the impact of the globalization of wine,Documentary,1019
The Motorcycle Diaries,https://en.wikipedia.org/wiki/The_Motorcycle_Diaries_(film),2004,Walter Salles,"Gael García Bernal, Rodrigo de la Serna",Biography,1020
Mr. 3000,https://en.wikipedia.org/wiki/Mr._3000,2004,Charles Stone III,"Bernie Mac, Angela Bassett, Paul Sorvino, Chris Noth",Comedy,1021
My Baby's Daddy,https://en.wikipedia.org/wiki/My_Baby%27s_Daddy,2004,Cheryl Dunye,"Eddie Griffin, Anthony Anderson, Michael Imperioli, Method Man",Comedy,1022
Mysterious Skin,https://en.wikipedia.org/wiki/Mysterious_Skin,2004,Gregg Araki,"Joseph Gordon-Levitt, Brady Corbet, Michelle Trachtenberg",Drama,1023
 Napoleon Dynamite,https://en.wikipedia.org/wiki/Napoleon_Dynamite,2004,Jared Hess,Jon Heder,Comedy,1024
National Treasure,https://en.wikipedia.org/wiki/National_Treasure_(film),2004,Jon Turteltaub,"Nicolas Cage, Diane Kruger, Justin Bartha, Jon Voight, Harvey Keitel, Sean Bean, Christopher Plummer",Adventure,1025
Never Die Alone,https://en.wikipedia.org/wiki/Never_Die_Alone,2004,Ernest R. Dickerson,"DMX, David Arquette",Crime drama,1026
New York Minute,https://en.wikipedia.org/wiki/New_York_Minute_(film),2004,Dennie Gordon,"Mary-Kate and Ashley Olsen, Eugene Levy",Comedy,1027
Noel,https://en.wikipedia.org/wiki/Noel_(film),2004,Chazz Palminteri,"Susan Sarandon, Alan Arkin, Penélope Cruz",Drama,1028
The Notebook,https://en.wikipedia.org/wiki/The_Notebook_(2004_film),2004,Nick Cassavetes,"Ryan Gosling, Rachel McAdams, James Marsden, James Garner, Gena Rowlands",Romance,1029
November,https://en.wikipedia.org/wiki/November_(film),2004,Greg Harrison,Courteney Cox,Thriller,1030
Ocean's Twelve,https://en.wikipedia.org/wiki/Ocean%27s_Twelve,2004,Steven Soderbergh,"George Clooney, Brad Pitt, Matt Damon, Catherine Zeta-Jones, Andy García, Don Cheadle, Bernie Mac, Julia Roberts","Comedy, Crime",1031
Otaku Unite!,https://en.wikipedia.org/wiki/Otaku_Unite!,2004,Eric Bresler,,Documentary,1032
P.S.,https://en.wikipedia.org/wiki/P.S._(film),2004,Dylan Kidd,"Laura Linney, Topher Grace, Gabriel Byrne",Romance,1033
Palindromes,https://en.wikipedia.org/wiki/Palindromes_(film),2004,Todd Solondz,"Ellen Barkin, Matthew Faber, Rachel Corr",Drama,1034
Paparazzi,https://en.wikipedia.org/wiki/Paparazzi_(2004_film),2004,Paul Abascal,"Cole Hauser, Robin Tunney, Tom Sizemore, Daniel Baldwin",Action,1035
The Passion of the Christ,https://en.wikipedia.org/wiki/The_Passion_of_the_Christ,2004,Mel Gibson,"Jim Caviezel, Monica Bellucci",Drama,1036
The Perfect Score,https://en.wikipedia.org/wiki/The_Perfect_Score,2004,Brian Robbins,"Scarlett Johansson, Erika Christensen, Chris Evans, Darius Miles",Crime,1037
The Phantom of the Opera,https://en.wikipedia.org/wiki/The_Phantom_of_the_Opera_(2004_film),2004,Joel Schumacher,"Gerard Butler, Emmy Rossum, Patrick Wilson",Musical,1038
The Polar Express,https://en.wikipedia.org/wiki/The_Polar_Express_(film),2004,Robert Zemeckis,"Tom Hanks, Daryl Sabara","Animation, Family",1039
Primer,https://en.wikipedia.org/wiki/Primer_(film),2004,Shane Carruth,"Shane Carruth, David Sullivan",Science fiction,1040
The Prince and Me,https://en.wikipedia.org/wiki/The_Prince_and_Me,2004,Martha Coolidge,"Julia Stiles, Luke Mably, Ben Miller",Comedy,1041
The Princess Diaries 2: Royal Engagement,https://en.wikipedia.org/wiki/The_Princess_Diaries_2:_Royal_Engagement,2004,Garry Marshall,"Anne Hathaway, Julie Andrews, Héctor Elizondo, Raven-Symoné, Chris Pine, Heather Matarazzo",Comedy,1042
Proud,https://en.wikipedia.org/wiki/Proud_(film),2004,Mary Pat Kelly,Reggie Austin,Drama,1043
The Punisher,https://en.wikipedia.org/wiki/The_Punisher_(2004_film),2004,Jonathan Hensleigh,"Thomas Jane, John Travolta, Rebecca Romijn",Superhero,1044
 Raise Your Voice,https://en.wikipedia.org/wiki/Raise_Your_Voice,2004,Sean McNamara,Hilary Duff,Musical,1045
Raising Helen,https://en.wikipedia.org/wiki/Raising_Helen,2004,Garry Marshall,"Kate Hudson, John Corbett, Joan Cusack, Hayden Panettiere, Spencer Breslin, Helen Mirren, Abigail Breslin",Comedy,1046
Ray,https://en.wikipedia.org/wiki/Ray_(film),2004,Taylor Hackford,Jamie Foxx,Biography,1047
Riding Giants,https://en.wikipedia.org/wiki/Riding_Giants,2004,Stacy Peralta,The art of big wave surfing,Documentary,1048
Riding the Bullet,https://en.wikipedia.org/wiki/Riding_the_Bullet_(film),2004,Mick Garris,"Jonathan Jackson, David Arquette, Cliff Robertson",Horror,1049
Ripley's Game,https://en.wikipedia.org/wiki/Ripley%27s_Game,2004,Liliana Cavani,"John Malkovich, Dougray Scott, Ray Winstone, Chiara Caselli, Lena Headey",Thriller,1050
 Saved!,https://en.wikipedia.org/wiki/Saved!,2004,Brian Dannelly,"Jena Malone, Mandy Moore, Macaulay Culkin, Patrick Fugit, Heather Matarazzo, Eva Amurri, Martin Donovan, Mary-Louise Parker","Comedy, Teen",1051
Saw,https://en.wikipedia.org/wiki/Saw_(2004_film),2004,James Wan,"Cary Elwes, Leigh Whannell, Danny Glover, Monica Potter",Psychological Horror,1052
Scooby-Doo 2: Monsters Unleashed,https://en.wikipedia.org/wiki/Scooby-Doo_2:_Monsters_Unleashed,2004,Raja Gosnell,"Freddie Prinze, Jr., Sarah Michelle Gellar, Matthew Lillard, Linda Cardellini","Comedy, Family",1053
Secret Window,https://en.wikipedia.org/wiki/Secret_Window,2004,David Koepp,"Johnny Depp, John Turturro, Timothy Hutton",Thriller,1054
Seed of Chucky,https://en.wikipedia.org/wiki/Seed_of_Chucky,2004,Don Mancini,"Jennifer Tilly, Redman, Hannah Spearritt, John Waters",Horror,1055
Shall We Dance?,https://en.wikipedia.org/wiki/Shall_We_Dance%3F_(2004_film),2004,Peter Chelsom,"Richard Gere, Jennifer Lopez, Susan Sarandon",Romance,1056
Shark Tale,https://en.wikipedia.org/wiki/Shark_Tale,2004,"Bibo Bergeron, Vicky Jenson, Rob Letterman","Will Smith, Jack Black, Renée Zellweger, Angelina Jolie, Robert De Niro, Martin Scorsese","Animation, family",1057
She Hate Me,https://en.wikipedia.org/wiki/She_Hate_Me,2004,Spike Lee,"Anthony Mackie, Kerry Washington, Ellen Barkin, Monica Bellucci, Jim Brown, Brian Dennehy, Woody Harrelson, Bai Ling, Q-Tip, Dania Ramirez, John Turturro",Comedy-drama,1058
Shrek 2,https://en.wikipedia.org/wiki/Shrek_2,2004,"Andrew Adamson, Kelly Asbury, Conrad Vernon","Mike Myers, Cameron Diaz, Eddie Murphy, Antonio Banderas","Animation, family",1059
Sideways,https://en.wikipedia.org/wiki/Sideways,2004,Alexander Payne,"Paul Giamatti, Thomas Haden Church, Virginia Madsen, Sandra Oh",Comedy,1060
Six: The Mark Unleashed,https://en.wikipedia.org/wiki/Six:_The_Mark_Unleashed,2004,Kevin Downes,"Stephen Baldwin, Eric Roberts, Kevin Downes",Action,1061
Silver City,https://en.wikipedia.org/wiki/Silver_City_(2004_film),2004,John Sayles,"Danny Huston, Chris Cooper, Richard Dreyfuss, Maria Bello",Comedy,1062
Sky Captain and the World of Tomorrow,https://en.wikipedia.org/wiki/Sky_Captain_and_the_World_of_Tomorrow,2004,Kerry Conran,"Jude Law, Gwyneth Paltrow, Angelina Jolie",Science fiction,1063
Sleepover,https://en.wikipedia.org/wiki/Sleepover_(film),2004,Joe Nussbaum,"Alexa Vega, Sara Paxton, Mika Boorem, Sam Huntington",Comedy,1064
Some Kind of Monster,https://en.wikipedia.org/wiki/Some_Kind_of_Monster_(film),2004,"Joe Berlinger, Bruce Sinofsky",the band Metallica,Documentary,1065
Soul Plane,https://en.wikipedia.org/wiki/Soul_Plane,2004,Jessy Terrero,"Snoop Dogg, Tom Arnold, Kevin Hart",Comedy,1066
Spanglish,https://en.wikipedia.org/wiki/Spanglish_(film),2004,James L. Brooks,"Adam Sandler, Téa Leoni, Paz Vega, Cloris Leachman",Comedy-drama,1067
Spartan,https://en.wikipedia.org/wiki/Spartan_(film),2004,David Mamet,"Val Kilmer, Derek Luke, William H. Macy",Crime drama,1068
Speak,https://en.wikipedia.org/wiki/Speak_(film),2004,Jessica Sharzer,"Kristen Stewart, Steve Zahn",Drama,1069
Spider-Man 2,https://en.wikipedia.org/wiki/Spider-Man_2,2004,Sam Raimi,"Tobey Maguire, Kirsten Dunst, James Franco, Alfred Molina, Rosemary Harris",Superhero,1070
The SpongeBob SquarePants Movie,https://en.wikipedia.org/wiki/The_SpongeBob_SquarePants_Movie,2004,Stephen Hillenburg,"Tom Kenny, Clancy Brown, Rodger Bumpass, Bill Fagerbakke",Animation,1071
Stage Beauty,https://en.wikipedia.org/wiki/Stage_Beauty,2004,Richard Eyre,"Billy Crudup, Claire Danes, Rupert Everett",Drama,1072
Starsky & Hutch,https://en.wikipedia.org/wiki/Starsky_%26_Hutch_(film),2004,Todd Phillips,"Ben Stiller, Owen Wilson, Vince Vaughn, Snoop Dogg, Juliette Lewis, Amy Smart, Carmen Electra","Crime, Comedy",1073
Stateside,https://en.wikipedia.org/wiki/Stateside_(film),2004,Reverge Anselmo,"Rachael Leigh Cook, Jonathan Tucker, Agnes Bruckner",Drama,1074
The Stepford Wives,https://en.wikipedia.org/wiki/The_Stepford_Wives_(2004_film),2004,Frank Oz,"Nicole Kidman, Matthew Broderick, Glenn Close, Bette Midler, Christopher Walken, Faith Hill","Comedy, Science fiction",1075
Straight-Jacket,https://en.wikipedia.org/wiki/Straight-Jacket,2004,Richard Day,"Matt Letscher, Carrie Preston",Comedy,1076
Super Size Me,https://en.wikipedia.org/wiki/Super_Size_Me,2004,Morgan Spurlock,30-day period of eating food only from McDonald's,Documentary,1077
SuperBabies: Baby Geniuses 2,https://en.wikipedia.org/wiki/SuperBabies:_Baby_Geniuses_2,2004,Bob Clark,"Jon Voight, Scott Baio, Vanessa Angel",Comedy,1078
Surviving Christmas,https://en.wikipedia.org/wiki/Surviving_Christmas,2004,Mike Mitchell,"Ben Affleck, James Gandolfini, Christina Applegate, Catherine O'Hara",Comedy,1079
Suspect Zero,https://en.wikipedia.org/wiki/Suspect_Zero,2004,E. Elias Merhige,"Aaron Eckhart, Ben Kingsley, Carrie-Anne Moss",Thriller,1080
 Taking Lives,https://en.wikipedia.org/wiki/Taking_Lives_(film),2004,D. J. Caruso,"Angelina Jolie, Ethan Hawke, Kiefer Sutherland, Olivier Martinez, Gena Rowlands",Horror,1081
Taxi,https://en.wikipedia.org/wiki/Taxi_(2004_film),2004,Tim Story,"Queen Latifah, Jimmy Fallon",Comedy,1082
Teacher's Pet,https://en.wikipedia.org/wiki/Teacher%27s_Pet_(2004_film),2004,Timothy Björklund,"Nathan Lane, Kelsey Grammer, Shaun Fleming",Animation,1083
Team America: World Police,https://en.wikipedia.org/wiki/Team_America:_World_Police,2004,Trey Parker,"Trey Parker, Matt Stone, Kristen Miller",Animation,1084
The Terminal,https://en.wikipedia.org/wiki/The_Terminal,2004,Steven Spielberg,"Tom Hanks, Catherine Zeta-Jones",Comedy,1085
Torque,https://en.wikipedia.org/wiki/Torque_(film),2004,Joseph Kahn,"Martin Henderson, Ice Cube, Monet Mazur, Jay Hernandez, Jaime Pressly",Action,1086
Troy,https://en.wikipedia.org/wiki/Troy_(film),2004,Wolfgang Petersen,"Brad Pitt, Eric Bana, Orlando Bloom, Brian Cox, Brendan Gleeson, Peter O'Toole, Diane Kruger, Rose Byrne, Saffron Burrows, Julie Christie",Adventure,1087
Twisted,https://en.wikipedia.org/wiki/Twisted_(2004_film),2004,Philip Kaufman,"Ashley Judd, Samuel L. Jackson, Andy García",Thriller,1088
 Undertow,https://en.wikipedia.org/wiki/Undertow_(2004_film),2004,David Gordon Green,"Jamie Bell, Dermot Mulroney, Josh Lucas, Devon Alan",Thriller,1089
University Heights,https://en.wikipedia.org/wiki/University_Heights_(film),2004,Scott Beck,"Jim Siokos, Shane Simmons, Travis Shepherd",Drama,1090
 Van Helsing,https://en.wikipedia.org/wiki/Van_Helsing_(film),2004,Stephen Sommers,"Hugh Jackman, Kate Beckinsale, Richard Roxburgh, David Wenham, Will Kemp, Kevin J. O'Connor, Shuler Hensley",Horror,1091
Vanity Fair,https://en.wikipedia.org/wiki/Vanity_Fair_(2004_film),2004,Mira Nair,"Reese Witherspoon, Jonathan Rhys Meyers, James Purefoy",Romance,1092
A Very Long Engagement,https://en.wikipedia.org/wiki/A_Very_Long_Engagement,2004,Jean-Pierre Jeunet,"Audrey Tautou, Gaspard Ulliel, Jodie Foster",War film,1093
The Village,https://en.wikipedia.org/wiki/The_Village_(2004_film),2004,M. Night Shyamalan,"Bryce Dallas Howard, Joaquin Phoenix, Adrien Brody, William Hurt, Sigourney Weaver",Suspense,1094
Voces inocentes,https://en.wikipedia.org/wiki/Voces_inocentes,2004,Luis Mandoki,"Carlos Padilla, Leonor Varela, Xuna Primus",War film,1095
Voices of Iraq,https://en.wikipedia.org/wiki/Voices_of_Iraq,2004,Martin Kunert,Iraq,Documentary,1096
 Walking Tall,https://en.wikipedia.org/wiki/Walking_Tall_(2004_film),2004,Kevin Bray,Dwayne Johnson,Action,1097
Wake of Death,https://en.wikipedia.org/wiki/Wake_of_Death,2004,Philippe Martinez,Jean-Claude Van Damme,Action,1098
Watermarks,https://en.wikipedia.org/wiki/Watermarks_(film),2004,Yaron Zilberman,women from Viennese Hakoah swim team,Documentary,1099
We Don't Live Here Anymore,https://en.wikipedia.org/wiki/We_Don%27t_Live_Here_Anymore,2004,John Curran,"Mark Ruffalo, Laura Dern, Naomi Watts, Peter Krause",Drama,1100
Welcome to Mooseport,https://en.wikipedia.org/wiki/Welcome_to_Mooseport,2004,Donald Petrie,"Ray Romano, Gene Hackman, Marcia Gay Harden",Comedy,1101
When Will I Be Loved,https://en.wikipedia.org/wiki/When_Will_I_Be_Loved_(film),2004,James Toback,"Neve Campbell, Fred Weller, Alex Feldman",Drama,1102
White Chicks,https://en.wikipedia.org/wiki/White_Chicks,2004,Keenen Ivory Wayans,"Shawn Wayans, Marlon Wayans",Comedy,1103
The Whole Ten Yards,https://en.wikipedia.org/wiki/The_Whole_Ten_Yards,2004,Howard Deutch,"Matthew Perry, Bruce Willis, Amanda Peet, Natasha Henstridge, Kevin Pollak",Comedy,1104
Wicker Park,https://en.wikipedia.org/wiki/Wicker_Park_(film),2004,Paul McGuigan,"Josh Hartnett, Rose Byrne, Diane Kruger, Matthew Lillard",Drama,1105
Win a Date with Tad Hamilton!,https://en.wikipedia.org/wiki/Win_a_Date_with_Tad_Hamilton!,2004,Robert Luketic,"Kate Bosworth, Topher Grace, Josh Duhamel",Comedy,1106
Winter Solstice,https://en.wikipedia.org/wiki/Winter_Solstice_(film),2004,Josh Sternfeld,"Anthony LaPaglia, Aaron Stanford",Drama,1107
Without a Paddle,https://en.wikipedia.org/wiki/Without_a_Paddle,2004,Steven Brill,"Matthew Lillard, Seth Green, Dax Shepard",Comedy,1108
Woman Thou Art Loosed,https://en.wikipedia.org/wiki/Woman_Thou_Art_Loosed,2004,Michael Schultz,"Kimberly Elise, Loretta Devine, Debbi Morgan",Drama,1109
The Woodsman,https://en.wikipedia.org/wiki/The_Woodsman_(2004_film),2004,Nicole Kassell,"Kevin Bacon, Kyra Sedgwick, Eve, Mos Def",Drama,1110
The Work and the Glory,https://en.wikipedia.org/wiki/The_Work_and_the_Glory_(film),2004,Russell Holt,"Sam Hennings, Brenda Strong, Eric Johnson",Drama,1111
 The Year of the Yao,https://en.wikipedia.org/wiki/The_Year_of_the_Yao,2004,"Adam Del Deo, James D. Stern",The first of year of Yao Ming's American career,Documentary,1112
You Got Served,https://en.wikipedia.org/wiki/You_Got_Served,2004,Chris Stokes,"Marques Houston, Omarion Grandberry, Jennifer Freeman",Comedy,1113
 The 40-Year-Old Virgin,https://en.wikipedia.org/wiki/The_40-Year-Old_Virgin,2005,Judd Apatow,"Steve Carell, Catherine Keener, Paul Rudd",Comedy,1114
51 Birch Street,https://en.wikipedia.org/wiki/51_Birch_Street,2005,Doug Block,"love, marriage, fidelity and a suburban family",Documentary,1115
 The Adventures of Sharkboy and Lavagirl in 3-D,https://en.wikipedia.org/wiki/The_Adventures_of_Sharkboy_and_Lavagirl_in_3-D,2005,Robert Rodriguez,"Taylor Lautner, Taylor Dooley, Cayden Boyd, George Lopez","Family, superhero",1116
Æon Flux,https://en.wikipedia.org/wiki/%C3%86on_Flux_(film),2005,Karyn Kusama,Charlize Theron,Science fiction,1117
Aliens of the Deep,https://en.wikipedia.org/wiki/Aliens_of_the_Deep,2005,"James Cameron, Steve Quale",the Mid-Ocean Ridge,Documentary,1118
Alone in the Dark,https://en.wikipedia.org/wiki/Alone_in_the_Dark_(2005_film),2005,Uwe Boll,"Christian Slater, Tara Reid, Stephen Dorff",Comedy,1119
The Amityville Horror,https://en.wikipedia.org/wiki/The_Amityville_Horror_(2005_film),2005,Andrew Douglas,"Ryan Reynolds, Melissa George, Jesse James, Jimmy Bennett",Horror,1120
Are We There Yet?,https://en.wikipedia.org/wiki/Are_We_There_Yet%3F_(film),2005,Brian Levant,Ice Cube,Comedy,1121
The Aristocrats,https://en.wikipedia.org/wiki/The_Aristocrats_(film),2005,Paul Provenza,"the obscure dirty joke ""The Aristocrats""",Documentary,1122
Assault on Precinct 13,https://en.wikipedia.org/wiki/Assault_on_Precinct_13_(2005_film),2005,Jean-François Richet,"Ethan Hawke, Laurence Fishburne, Gabriel Byrne",Action,1123
 Bad News Bears,https://en.wikipedia.org/wiki/Bad_News_Bears,2005,Richard Linklater,"Billy Bob Thornton, Greg Kinnear",Comedy,1124
The Ballad of Jack and Rose,https://en.wikipedia.org/wiki/The_Ballad_of_Jack_and_Rose,2005,Rebecca Miller,"Daniel Day-Lewis, Camilla Belle",Drama,1125
Batman Begins,https://en.wikipedia.org/wiki/Batman_Begins,2005,Christopher Nolan,"Christian Bale, Michael Caine, Liam Neeson, Katie Holmes, Gary Oldman, Morgan Freeman",Superhero,1126
The Baxter,https://en.wikipedia.org/wiki/The_Baxter,2005,Michael Showalter,"Michael Showalter, Elizabeth Banks, Michelle Williams",Comedy,1127
Be Cool,https://en.wikipedia.org/wiki/Be_Cool,2005,F. Gary Gray,"John Travolta, Uma Thurman, Cedric the Entertainer, André Benjamin, Steven Tyler, Vince Vaughn",Crime comedy,1128
Beauty Shop,https://en.wikipedia.org/wiki/Beauty_Shop,2005,Bille Woodruff,Queen Latifah,Comedy,1129
Because of Winn-Dixie,https://en.wikipedia.org/wiki/Because_of_Winn-Dixie_(film),2005,Wayne Wang,"AnnaSophia Robb, Jeff Daniels, Cicely Tyson",Family,1130
Bee Season,https://en.wikipedia.org/wiki/Bee_Season_(film),2005,"David Siegel, Scott McGehee","Richard Gere, Juliette Binoche, Flora Cross, Max Minghella",Drama,1131
Bewitched,https://en.wikipedia.org/wiki/Bewitched_(2005_film),2005,Nora Ephron,"Nicole Kidman, Will Ferrell, Michael Caine, Jason Schwartzman, Shirley MacLaine",Comedy,1132
Bigger Than the Sky,https://en.wikipedia.org/wiki/Bigger_Than_the_Sky,2005,Al Corley,"Marcus Thomas, John Corbett, Amy Smart",Comedy,1133
Boogeyman,https://en.wikipedia.org/wiki/Boogeyman_(film),2005,Stephen Kay,"Barry Watson, Emily Deschanel, Lucy Lawless",Horror,1134
Brick,https://en.wikipedia.org/wiki/Brick_(film),2005,Rian Johnson,"Joseph Gordon-Levitt, Emilie de Ravin, Nora Zehetner",Neo-noir,1135
Brokeback Mountain,https://en.wikipedia.org/wiki/Brokeback_Mountain,2005,Ang Lee,"Heath Ledger, Jake Gyllenhaal, Anne Hathaway, Michelle Williams, Randy Quaid","Western, Romantic Drama",1136
Broken Flowers,https://en.wikipedia.org/wiki/Broken_Flowers,2005,Jim Jarmusch,"Bill Murray, Jeffrey Wright, Sharon Stone, Frances Conroy, Jessica Lange, Tilda Swinton",Comedy-drama,1137
The Brothers Grimm,https://en.wikipedia.org/wiki/The_Brothers_Grimm_(film),2005,Terry Gilliam,"Matt Damon, Heath Ledger, Jonathan Pryce","Adventure, Fantasy",1138
Capote,https://en.wikipedia.org/wiki/Capote_(film),2005,Bennett Miller,"Philip Seymour Hoffman, Catherine Keener, Clifton Collins, Jr., Chris Cooper, Amy Ryan","Biography, Crime",1139
Casanova,https://en.wikipedia.org/wiki/Casanova_(2005_film),2005,Lasse Hallström,"Heath Ledger, Jeremy Irons, Sienna Miller",Comedy,1140
The Cave,https://en.wikipedia.org/wiki/The_Cave_(film),2005,Bruce Hunt,"Cole Hauser, Eddie Cibrian, Morris Chestnut, Lena Headey",Horror,1141
Charlie and the Chocolate Factory,https://en.wikipedia.org/wiki/Charlie_and_the_Chocolate_Factory_(film),2005,Tim Burton,"Johnny Depp, Freddie Highmore, David Kelly, Helena Bonham Carter, Christopher Lee, Missi Pyle, James Fox",Fantasy,1142
Cheaper by the Dozen 2,https://en.wikipedia.org/wiki/Cheaper_by_the_Dozen_2,2005,Adam Shankman,"Steve Martin, Bonnie Hunt, Hilary Duff, Tom Welling, Piper Perabo, Eugene Levy, Carmen Electra",Comedy,1143
Chicken Little,https://en.wikipedia.org/wiki/Chicken_Little_(2005_film),2005,Mark Dindal,"Zach Braff, Joan Cusack, Steve Zahn",Animation,1144
"The Chronicles of Narnia: The Lion, the Witch and the Wardrobe","https://en.wikipedia.org/wiki/The_Chronicles_of_Narnia:_The_Lion,_the_Witch_and_the_Wardrobe",2005,Andrew Adamson,"William Mosely, Anna Popplewell, Skandar Keynes, Georgie Henley","Adventure, Epic Fantasy,",1145
The Chumscrubber,https://en.wikipedia.org/wiki/The_Chumscrubber,2005,Arie Posin,"Glenn Close, Ralph Fiennes, Caroline Goodall",Comedy,1146
Cinderella Man,https://en.wikipedia.org/wiki/Cinderella_Man,2005,Ron Howard,"Russell Crowe, Renée Zellweger, Paul Giamatti, Bruce McGill, Craig Bierko","Biography, Drama",1147
Coach Carter,https://en.wikipedia.org/wiki/Coach_Carter,2005,Thomas Carter,"Samuel L. Jackson, Rob Brown, Ashanti, Channing Tatum",Drama,1148
Constantine,https://en.wikipedia.org/wiki/Constantine_(film),2005,Francis Lawrence,"Keanu Reeves, Rachel Weisz, Shia LaBeouf",Horror,1149
Corpse Bride,https://en.wikipedia.org/wiki/Corpse_Bride,2005,Tim Burton,"Johnny Depp, Helena Bonham Carter",Animation,1150
The Crow: Wicked Prayer,https://en.wikipedia.org/wiki/The_Crow:_Wicked_Prayer,2005,Lance Mungia,"Edward Furlong, David Boreanaz, Tara Reid, Emmanuelle Chriqui",Action,1151
Cruel World,https://en.wikipedia.org/wiki/Cruel_World,2005,Kelsey T. Howard,"Edward Furlong, Susan Ward, Daniel Franzese, Andrew Keegan",Horror,1152
Cry_Wolf,https://en.wikipedia.org/wiki/Cry_Wolf_(2005_film),2005,Jeff Wadlow,"Julian Morris, Lindy Booth, Jon Bon Jovi, Kristy Wu",Drama,1153
Cursed,https://en.wikipedia.org/wiki/Cursed_(2005_film),2005,Wes Craven,"Christina Ricci, Jesse Eisenberg, Joshua Jackson, Judy Greer",Horror,1154
 Daltry Calhoun,https://en.wikipedia.org/wiki/Daltry_Calhoun,2005,Katrina Holden Bronson,Johnny Knoxville,Comedy,1155
Dark Water,https://en.wikipedia.org/wiki/Dark_Water_(2005_film),2005,Walter Salles,Jennifer Connelly,Horror,1156
Deepwater,https://en.wikipedia.org/wiki/Deepwater_(film),2005,David S. Marfield,"Lucas Black, Peter Coyote, Mia Maestro",Thriller,1157
Derailed,https://en.wikipedia.org/wiki/Derailed_(2005_film),2005,Mikael Håfström,"Clive Owen, Jennifer Aniston, Vincent Cassel",Thriller,1158
The Derby Stallion,https://en.wikipedia.org/wiki/The_Derby_Stallion,2005,Craig Clyde,"Zac Efron, Bill Cobbs, Crystal Hunt, Rob Pinkston",Drama,1159
Deuce Bigalow: European Gigolo,https://en.wikipedia.org/wiki/Deuce_Bigalow:_European_Gigolo,2005,Mike Bigelow,"Rob Schneider, Eddie Griffin",Comedy,1160
The Devil's Rejects,https://en.wikipedia.org/wiki/The_Devil%27s_Rejects,2005,Rob Zombie,"Sid Haig, Bill Moseley, Sherri Moon, William Forsythe",Horror,1161
Diary of a Mad Black Woman,https://en.wikipedia.org/wiki/Diary_of_a_Mad_Black_Woman_(film),2005,Darren Grant,"Kimberly Elise, Steve Harris, Shemar Moore, Cicely Tyson, Tyler Perry",Comedy-drama,1162
Dirty Love,https://en.wikipedia.org/wiki/Dirty_Love_(film),2005,John Mallory Asher,"Jenny McCarthy, Eddie Kaye Thomas, Carmen Electra, Victor Webster, Kam Heskin, Kathy Griffin",Comedy,1163
Dominion: Prequel to the Exorcist,https://en.wikipedia.org/wiki/Dominion:_Prequel_to_the_Exorcist,2005,Paul Schrader,"Stellan Skarsgård, Gabriel Mann, Billy Crawford, Ralph Brown",Horror,1164
