Movie,URL,Year,Director,Cast,Genre,Movie_ID
Pathology,https://en.wikipedia.org/wiki/Pathology_(film),2008,Marc Schoelermann,"Milo Ventimiglia, Michael Weston, Alyssa Milano, Lauren Lee Smith",Thriller,2189
Patti Smith: Dream of Life,https://en.wikipedia.org/wiki/Patti_Smith:_Dream_of_Life,2008,Steven Sebring,the career of Patti Smith,Documentary,2190
Pineapple Express,https://en.wikipedia.org/wiki/Pineapple_Express_(film),2008,David Gordon Green,"Seth Rogen, James Franco",Comedy,2191
The Pirates Who Don't Do Anything: A VeggieTales Movie,https://en.wikipedia.org/wiki/The_Pirates_Who_Don%27t_Do_Anything:_A_VeggieTales_Movie,2008,Mike Nawrocki,"Mike Nawrocki, Phil Vischer, Tim Hodge",Animation,2192
Pray the Devil Back to Hell,https://en.wikipedia.org/wiki/Pray_the_Devil_Back_to_Hell,2008,Gini Reticker,women in Liberia,Documentary,2193
Pride and Glory,https://en.wikipedia.org/wiki/Pride_and_Glory_(film),2008,Gavin O'Connor,"Edward Norton, Colin Farrell",Crime drama,2194
Prom Night,https://en.wikipedia.org/wiki/Prom_Night_(2008_film),2008,Nelson McCormick,"Brittany Snow, Scott Porter, Johnathon Schaech, Idris Elba",Horror,2195
The Promotion,https://en.wikipedia.org/wiki/The_Promotion,2008,Steven Conrad,"Seann William Scott, John C. Reilly",Comedy,2196
Proud American,https://en.wikipedia.org/wiki/Proud_American,2008,Fred Ashman,the American spirit,Documentary,2197
Punisher: War Zone,https://en.wikipedia.org/wiki/Punisher:_War_Zone,2008,Lexi Alexander,"Ray Stevenson, Dominic West, Doug Hutchison, Wayne Knight",Superhero,2198
 Quantum of Solace,https://en.wikipedia.org/wiki/Quantum_of_Solace,2008,Marc Forster,"Daniel Craig, Olga Kurylenko, Mathieu Amalric","Action, 007",2199
Quarantine,https://en.wikipedia.org/wiki/Quarantine_(2008_film),2008,John Erick Dowdle,"Jennifer Carpenter, Steve Harris, Jay Hernandez, Columbus Short",Horror,2200
 Rachel Getting Married,https://en.wikipedia.org/wiki/Rachel_Getting_Married,2008,Jonathan Demme,"Anne Hathaway, Debra Winger, Rosemarie DeWitt",Drama,2201
Rambo,https://en.wikipedia.org/wiki/Rambo_(2008_film),2008,Sylvester Stallone,"Sylvester Stallone, Julie Benz",Action,2202
The Reader,https://en.wikipedia.org/wiki/The_Reader_(2008_film),2008,Stephen Daldry,"Kate Winslet, Ralph Fiennes, David Kross, Lena Olin",Drama,2203
Redbelt,https://en.wikipedia.org/wiki/Redbelt,2008,David Mamet,"Chiwetel Ejiofor, Tim Allen, Alice Braga, Randy Couture, Ricky Jay, Joe Mantegna, Emily Mortimer, David Paymer, Rebecca Pidgeon, Rodrigo Santoro","Drama, Martial arts",2204
Religulous,https://en.wikipedia.org/wiki/Religulous,2008,Larry Charles,organized religion and religious belief,Documentary,2205
Rent: Filmed Live on Broadway,https://en.wikipedia.org/wiki/Rent:_Filmed_Live_on_Broadway,2008,Michael John Warren,Rent,Musical,2206
Repo! The Genetic Opera,https://en.wikipedia.org/wiki/Repo!_The_Genetic_Opera,2008,Darren Lynn Bousman,"Alexa Vega, Anthony Stewart Head, Sarah Brightman, Paris Hilton","Horror, Musical",2207
Revolutionary Road,https://en.wikipedia.org/wiki/Revolutionary_Road_(film),2008,Sam Mendes,"Leonardo DiCaprio, Kate Winslet, Michael Shannon, Kathryn Hahn, Kathy Bates",Drama,2208
Righteous Kill,https://en.wikipedia.org/wiki/Righteous_Kill,2008,Jon Avnet,"Robert De Niro, Al Pacino, Carla Gugino, Curtis Jackson, Donnie Wahlberg",Crime drama,2209
The Rocker,https://en.wikipedia.org/wiki/The_Rocker_(film),2008,Peter Cattaneo,"Rainn Wilson, Christina Applegate, Jeff Garlin, Josh Gad, Teddy Geiger, Emma Stone",Comedy,2210
Role Models,https://en.wikipedia.org/wiki/Role_Models,2008,David Wain,"Seann William Scott, Paul Rudd, Christopher Mintz-Plasse, Bobb'e J. Thompson, Jane Lynch, Elizabeth Banks",Comedy,2211
The Ruins,https://en.wikipedia.org/wiki/The_Ruins_(film),2008,Carter Smith,"Jonathan Tucker, Jena Malone, Shawn Ashmore, Laura Ramsey, Joe Anderson",Horror,2212
 Saw V,https://en.wikipedia.org/wiki/Saw_V,2008,David Hackl,"Tobin Bell, Julie Benz, Meagan Good, Costas Mandylor",Horror,2213
The Secret Life of Bees,https://en.wikipedia.org/wiki/The_Secret_Life_of_Bees_(film),2008,Gina Prince-Bythewood,"Queen Latifah, Dakota Fanning, Jennifer Hudson, Alicia Keys, Sophie Okenedo, Paul Bettany, Tristan Wilds",Drama,2214
Semi-Pro,https://en.wikipedia.org/wiki/Semi-Pro,2008,Kent Alterman,"Will Ferrell, Woody Harrelson, André Benjamin","Comedy, Sports",2215
Seven Pounds,https://en.wikipedia.org/wiki/Seven_Pounds,2008,Gabriele Muccino,"Will Smith, Rosario Dawson, Woody Harrelson, Barry Pepper",Drama,2216
Sex and the City,https://en.wikipedia.org/wiki/Sex_and_the_City_(film),2008,Michael Patrick King,"Sarah Jessica Parker, Kim Cattrall, Kristin Davis, Cynthia Nixon, Chris Noth",Comedy,2217
Sex Drive,https://en.wikipedia.org/wiki/Sex_Drive_(film),2008,Sean Anders,"Josh Zuckerman, Amanda Crew, Clark Duke, Seth Green, James Marsden",Comedy,2218
Shutter,https://en.wikipedia.org/wiki/Shutter_(2008_film),2008,Masayuki Ochiai,"Joshua Jackson, Rachael Taylor, James Kyson Lee, David Denman",Horror,2219
The Sisterhood of the Traveling Pants 2,https://en.wikipedia.org/wiki/The_Sisterhood_of_the_Traveling_Pants_2,2008,Sanaa Hamri,"Amber Tamblyn, America Ferrera, Blake Lively, Alexis Bledel",Comedy-drama,2220
Sleepwalking,https://en.wikipedia.org/wiki/Sleepwalking_(film),2008,William Maher,"Nick Stahl, AnnaSophia Robb, Charlize Theron, Woody Harrelson, Dennis Hopper",Drama,2221
Smart People,https://en.wikipedia.org/wiki/Smart_People,2008,Noam Murro,"Dennis Quaid, Sarah Jessica Parker, Ellen Page, Thomas Haden Church, Ashton Holmes",Comedy,2222
Soul Men,https://en.wikipedia.org/wiki/Soul_Men_(film),2008,Malcolm D. Lee,"Samuel L. Jackson, Bernie Mac","Comedy, Musical",2223
Space Chimps,https://en.wikipedia.org/wiki/Space_Chimps,2008,Kirk De Micco,"Cheryl Hines, Stanley Tucci, Kenan Thompson, Andy Samberg",Animation,2224
Speed Racer,https://en.wikipedia.org/wiki/Speed_Racer_(film),2008,Andy and Larry Wachowski,"Emile Hirsch, Christina Ricci, John Goodman, Susan Sarandon, Matthew Fox",Science fiction,2225
The Spiderwick Chronicles,https://en.wikipedia.org/wiki/The_Spiderwick_Chronicles_(film),2008,Mark Waters,"Freddie Highmore, Sarah Bolger, Mary-Louise Parker, David Strathairn","Family, Fantasy",2226
Spike,https://en.wikipedia.org/wiki/Spike_(2008_film),2008,Robert Beaucage,"Edward Gusts, Sarah Livingston Evans, Anna-Marie Wayne",Horror,2227
The Spirit,https://en.wikipedia.org/wiki/The_Spirit_(film),2008,Frank Miller,"Gabriel Macht, Samuel L. Jackson, Scarlett Johansson, Eva Mendes, Paz Vega, Dan Lauria",Science fiction,2228
Spy School,https://en.wikipedia.org/wiki/Spy_School,2008,Mark Blutman,"Forrest Landis, AnnaSophia Robb, Rider Strong, Roger Bart","Family, spy",2229
Star Wars: The Clone Wars,https://en.wikipedia.org/wiki/Star_Wars:_The_Clone_Wars_(film),2008,Dave Filoni,"James Arnold Taylor, Matt Lanter, Ashley Eckstein, Tom Kane",Animation,2230
Step Brothers,https://en.wikipedia.org/wiki/Step_Brothers_(film),2008,Adam McKay,"Will Ferrell, John C. Reilly, Richard Jenkins, Mary Steenburgen, Adam Scott, Kathryn Hahn",Comedy,2231
Step Up 2: The Streets,https://en.wikipedia.org/wiki/Step_Up_2:_The_Streets,2008,Jon Chu,"Briana Evigan, Robert Hoffman, Will Kemp, Adam G. Sevani",Dance,2232
Stop-Loss,https://en.wikipedia.org/wiki/Stop-Loss_(film),2008,Kimberly Peirce,"Ryan Phillippe, Abbie Cornish, Channing Tatum, Joseph Gordon-Levitt, Rob Brown",War,2233
Strange Wilderness,https://en.wikipedia.org/wiki/Strange_Wilderness,2008,Fred Wolf,"Steve Zahn, Allen Covert, Jonah Hill",Comedy,2234
The Strangers,https://en.wikipedia.org/wiki/The_Strangers_(2008_film),2008,Bryan Bertino,"Liv Tyler, Scott Speedman",Horror,2235
Street Kings,https://en.wikipedia.org/wiki/Street_Kings,2008,David Ayer,"Keanu Reeves, Forest Whitaker, Hugh Laurie, Chris Evans, Common, The Game",Crime drama,2236
Superhero Movie,https://en.wikipedia.org/wiki/Superhero_Movie,2008,Craig Mazin,"Drake Bell, Sara Paxton, Leslie Nielsen, Christopher McDonald","Comedy, parody",2237
Swing Vote,https://en.wikipedia.org/wiki/Swing_Vote_(2008_film),2008,Joshua Michael Stern,"Kevin Costner, Paula Patton, Kelsey Grammer, Dennis Hopper",Comedy,2238
Taken,https://en.wikipedia.org/wiki/Taken_(film),2008,Pierre Morel,"Liam Neeson, Famke Janssen, Maggie Grace",Thriller,2239
The Tale of Despereaux,https://en.wikipedia.org/wiki/The_Tale_of_Despereaux_(film),2008,"Sam Fell, Robert Stevenhagen","Matthew Broderick, Emma Watson, Dustin Hoffman, Robbie Coltrane",Animation,2240
Traitor,https://en.wikipedia.org/wiki/Traitor_(film),2008,Jeffrey Nachmanoff,"Don Cheadle, Guy Pearce, Jeff Daniels",Spy,2241
Tropic Thunder,https://en.wikipedia.org/wiki/Tropic_Thunder,2008,Ben Stiller,"Ben Stiller, Jack Black, Robert Downey, Jr., Steve Coogan, Nick Nolte, Tom Cruise",Comedy,2242
Trouble the Water,https://en.wikipedia.org/wiki/Trouble_the_Water,2008,"Tia Lessin, Carl Deal",two survivors of Hurricane Katrina,Documentary,2243
Twilight,https://en.wikipedia.org/wiki/Twilight_(2008_film),2008,Catherine Hardwicke,"Kristen Stewart, Robert Pattinson, Ashley Greene, Peter Facinelli, Billy Burke, Anna Kendrick","Fantasy, Romance",2244
U2 3D,https://en.wikipedia.org/wiki/U2_3D,2008,"Catherine Owens, Mark Pellington","Bono, The Edge, Adam Clayton, Larry Mullen, Jr.",Concert,2245
Untraceable,https://en.wikipedia.org/wiki/Untraceable,2008,Gregory Hoblit,"Diane Lane, Colin Hanks, Billy Burke, Joseph Michael Cross",Thriller,2246
 Valkyrie,https://en.wikipedia.org/wiki/Valkyrie_(film),2008,Bryan Singer,"Tom Cruise, Kenneth Branagh, Eddie Izzard, Bill Nighy",War,2247
Vantage Point,https://en.wikipedia.org/wiki/Vantage_Point_(film),2008,Pete Travis,"Dennis Quaid, Matthew Fox, Forest Whitaker, Sigourney Weaver, William Hurt",Thriller,2248
Vicky Cristina Barcelona,https://en.wikipedia.org/wiki/Vicky_Cristina_Barcelona,2008,Woody Allen,"Javier Bardem, Penélope Cruz, Scarlett Johansson, Rebecca Hall, Patricia Clarkson",Romance,2249
 W.,https://en.wikipedia.org/wiki/W._(film),2008,Oliver Stone,"Josh Brolin, James Cromwell, Ellen Burstyn, Elizabeth Banks, Thandie Newton, Richard Dreyfuss, Toby Jones, Jeffrey Wright, Scott Glenn","Biography, drama",2250
The Wackness,https://en.wikipedia.org/wiki/The_Wackness,2008,Jonathan Levine,"Ben Kingsley, Josh Peck, Famke Janssen, Olivia Thirlby, Mary-Kate Olsen, Method Man",Dramedy,2251
WALL-E,https://en.wikipedia.org/wiki/WALL-E,2008,Andrew Stanton,"Ben Burtt, Elissa Knight, Jeff Garlin, Fred Willard",Animation,2252
Waltz with Bashir,https://en.wikipedia.org/wiki/Waltz_with_Bashir,2008,Ari Folman,Ari Folman,Animation,2253
Wanted,https://en.wikipedia.org/wiki/Wanted_(2008_film),2008,Timur Bekmambetov,"James McAvoy, Morgan Freeman, Terence Stamp, Angelina Jolie",Action,2254
"War, Inc.","https://en.wikipedia.org/wiki/War,_Inc.",2008,Joshua Seftel,"John Cusack, Hilary Duff, Marisa Tomei, Joan Cusack",Action,2255
Welcome Home Roscoe Jenkins,https://en.wikipedia.org/wiki/Welcome_Home_Roscoe_Jenkins,2008,Malcolm D. Lee,"Martin Lawrence, Margaret Avery, Joy Bryant, Louis C.K.",Comedy,2256
What Doesn't Kill You,https://en.wikipedia.org/wiki/What_Doesn%27t_Kill_You,2008,Brian Goodman,"Mark Ruffalo, Ethan Hawke, Amanda Peet, Donnie Wahlberg",Crime drama,2257
What Happens in Vegas,https://en.wikipedia.org/wiki/What_Happens_in_Vegas,2008,Tom Vaughan,"Cameron Diaz, Ashton Kutcher, Dennis Farina",Comedy,2258
What Just Happened,https://en.wikipedia.org/wiki/What_Just_Happened,2008,Barry Levinson,"Robert De Niro, Sean Penn, Catherine Keener, John Turturro, Kristen Stewart, Stanley Tucci, Bruce Willis",Comedy,2259
Witless Protection,https://en.wikipedia.org/wiki/Witless_Protection,2008,Charles Robert Carner,"Larry the Cable Guy, Jenny McCarthy",Comedy,2260
The Women,https://en.wikipedia.org/wiki/The_Women_(2008_film),2008,Diane English,"Meg Ryan, Annette Bening, Eva Mendes, Debra Messing, Jada Pinkett Smith",Comedy,2261
The Wrestler,https://en.wikipedia.org/wiki/The_Wrestler_(2008_film),2008,Darren Arronofsky,"Mickey Rourke, Marisa Tomei, Evan Rachel Wood",Drama,2262
 The X-Files: I Want to Believe,https://en.wikipedia.org/wiki/The_X-Files:_I_Want_to_Believe,2008,Chris Carter,"David Duchovny, Gillian Anderson, Amanda Peet",Science fiction,2263
 Yes Man,https://en.wikipedia.org/wiki/Yes_Man_(film),2008,Peyton Reed,Jim Carrey,Comedy,2264
You Don't Mess with the Zohan,https://en.wikipedia.org/wiki/You_Don%27t_Mess_with_the_Zohan,2008,Dennis Dugan,"Adam Sandler, John Turturro, Emmanuelle Chriqui, Nick Swardson",Comedy,2265
 Zack and Miri Make a Porno,https://en.wikipedia.org/wiki/Zack_and_Miri_Make_a_Porno,2008,Kevin Smith,"Seth Rogen, Elizabeth Banks",Comedy,2266
 (500) Days of Summer,https://en.wikipedia.org/wiki/(500)_Days_of_Summer,2009,Marc Webb,"Joseph Gordon-Levitt, Zooey Deschanel",Romantic comedy,2267
12 Rounds,https://en.wikipedia.org/wiki/12_Rounds_(film),2009,Renny Harlin,"John Cena, Ashley Scott, Steve Harris, Aidan Gillen, Brian J. White, Taylor Cole",Action,2268
17 Again,https://en.wikipedia.org/wiki/17_Again_(film),2009,Burr Steers,"Zac Efron, Leslie Mann, Thomas Lennon, Matthew Perry, Melora Hardin, Michelle Trachtenberg, Sterling Knight","Comedy, Teen",2269
2012,https://en.wikipedia.org/wiki/2012_(film),2009,Roland Emmerich,"John Cusack, Amanda Peet, Danny Glover, Thandie Newton, Oliver Platt, Chiwetel Ejiofor, Woody Harrelson",Disaster,2270
9,https://en.wikipedia.org/wiki/9_(2009_animated_film),2009,Shane Acker,"Elijah Wood, John C. Reilly, Jennifer Connelly, Christopher Plummer, Crispin Glover, Martin Landau",Animated film,2271
 Adam,https://en.wikipedia.org/wiki/Adam_(2009_film),2009,Max Mayer,"Hugh Dancy, Rose Byrne, Peter Gallagher, Amy Irving, Frankie Faison, Mark Linn-Baker, Karina Arroyave",Comedy-drama,2272
Adventureland,https://en.wikipedia.org/wiki/Adventureland_(film),2009,Greg Mottola,"Jesse Eisenberg, Kristen Stewart, Martin Starr, Bill Hader, Kristen Wiig, Margarita Levieva, Ryan Reynolds",Comedy,2273
After.Life,https://en.wikipedia.org/wiki/After.Life,2009,Agnieszka Wojtowicz-Vosloo,"Christina Ricci, Liam Neeson, Justin Long, Celia Weston",Horror,2274
Alien Trespass,https://en.wikipedia.org/wiki/Alien_Trespass,2009,R. W. Goodwin,"Eric McCormack, Jenni Baird, Dan Lauria, Robert Patrick","Comedy, Science fiction",2275
Aliens in the Attic,https://en.wikipedia.org/wiki/Aliens_in_the_Attic,2009,John Schultz,"Robert Hoffman, Ashley Tisdale, Carter Jenkins, Austin Butler, Kevin Nealon, Doris Roberts",Science fiction,2276
All About Steve,https://en.wikipedia.org/wiki/All_About_Steve,2009,Phil Traill,"Sandra Bullock, Bradley Cooper, Thomas Haden Church",Comedy,2277
Alvin and the Chipmunks: The Squeakquel,https://en.wikipedia.org/wiki/Alvin_and_the_Chipmunks:_The_Squeakquel,2009,Betty Thomas,"Jason Lee, David Cross, Zachary Levi, Justin Long, Matthew Gray Gubler, Jesse McCartney, Anna Faris, Christina Applegate, Amy Poehler","Family, Musical",2278
Amelia,https://en.wikipedia.org/wiki/Amelia_(film),2009,Mira Nair,"Hilary Swank, Richard Gere, Ewan McGregor","Biography, Drama",2279
American Violet,https://en.wikipedia.org/wiki/American_Violet,2009,Tim Disney,"Nicole Beharie, Tim Blake Nelson, Will Patton, Michael O'Keefe, Xzibit, Charles S. Dutton, Alfre Woodard",Drama,2280
Angels & Demons,https://en.wikipedia.org/wiki/Angels_%26_Demons_(film),2009,Ron Howard,"Tom Hanks, Ayelet Zurer, Ewan McGregor, Stellan Skarsgård, Armin Mueller-Stahl, Pierfrancesco Favino, Nikolaj Lie Kaas","Adventure, Mystery",2281
The Answer Man,https://en.wikipedia.org/wiki/The_Answer_Man_(film),2009,John Hindman,"Jeff Daniels, Lauren Graham, Lou Taylor Pucci, Kat Dennings, Olivia Thirlby",Romantic comedy,2282
Arcadia Lost,https://en.wikipedia.org/wiki/Arcadia_Lost,2009,"Phedon Papamichael, Jr.","Nick Nolte, Haley Bennett, Carter Jenkins, Dato Bakhtadze, Lachlan Buchanan, James Ivory",Drama,2283
Armored,https://en.wikipedia.org/wiki/Armored_(film),2009,Nimród Antal,"Matt Dillon, Jean Reno, Laurence Fishburne, Milo Ventimiglia, Skeet Ulrich, Columbus Short, Amaury Nolasco, Fred Ward","Action, Crime drama",2284
Assassination of a High School President,https://en.wikipedia.org/wiki/Assassination_of_a_High_School_President,2009,Brett Simon,"Bruce Willis, Reece Thompson, Mischa Barton",Comedy,2285
Astro Boy,https://en.wikipedia.org/wiki/Astro_Boy_(film),2009,David Bowers,"Freddie Highmore, Nicolas Cage, Donald Sutherland, Nathan Lane, Bill Nighy, Eugene Levy, Kristen Bell",Animated film,2286
Avatar,https://en.wikipedia.org/wiki/Avatar_(2009_film),2009,James Cameron,"Sam Worthington, Zoe Saldana, Sigourney Weaver, Michelle Rodriguez, Stephen Lang, Laz Alonso, Giovanni Ribisi, Joel Moore, Wes Studi","Epic, Science fiction",2287
Away We Go,https://en.wikipedia.org/wiki/Away_We_Go,2009,Sam Mendes,"John Krasinski, Maya Rudolph, Jeff Daniels, Maggie Gyllenhaal, Allison Janney, Chris Messina, Catherine O'Hara, Paul Schneider, Jim Gaffigan, Melanie Lynskey, Josh Hamilton",Comedy-drama,2288
 The Bad Lieutenant: Port of Call New Orleans,https://en.wikipedia.org/wiki/The_Bad_Lieutenant:_Port_of_Call_New_Orleans,2009,Werner Herzog,"Nicolas Cage, Eva Mendes, Val Kilmer, Xzibit",Crime drama,2289
Bandslam,https://en.wikipedia.org/wiki/Bandslam,2009,Todd Graff,"Aly Michalka, Vanessa Hudgens, Gaelan Connell, Scott Porter, Lisa Kudrow",Musical,2290
Battle for Terra,https://en.wikipedia.org/wiki/Battle_for_Terra,2009,Aristomenis Tsirbas,"Evan Rachel Wood, Brian Cox, James Garner, Chris Evans, Danny Glover, Amanda Peet, David Cross, Justin Long, Dennis Quaid, Luke Wilson","Science fiction, Animated",2291
Berdella[2],https://en.wikipedia.org/wiki/Berdella,2009,"Paul South, William Taft","Vito Spino, Seth Correa, Marc Saleme, Steve Williams","Biography, Horror",2292
Beyond a Reasonable Doubt,https://en.wikipedia.org/wiki/Beyond_a_Reasonable_Doubt_(2009_film),2009,Peter Hyams,"Michael Douglas, Jesse Metcalfe, Amber Tamblyn, Orlando Jones",Drama,2293
Big Fan,https://en.wikipedia.org/wiki/Big_Fan,2009,Robert D. Siegel,"Patton Oswalt, Kevin Corrigan, Michael Rapaport, Marcia Jean Kurtz",Drama,2294
The Blind Side,https://en.wikipedia.org/wiki/The_Blind_Side_(film),2009,John Lee Hancock,"Sandra Bullock, Kathy Bates, Tim McGraw, Ray McKinnon, Quinton Aaron",Drama,2295
Boogie Town,https://en.wikipedia.org/wiki/Boogie_Town,2009,Chris Stokes,"Marques Houston, Brenda Song",Dance,2296
The Boondock Saints II: All Saints Day,https://en.wikipedia.org/wiki/The_Boondock_Saints_II:_All_Saints_Day,2009,Troy Duffy,"Sean Patrick Flanery, Norman Reedus, Clifton Collins, Jr., Julie Benz, Judd Nelson, Bob Marley, Brian Mahoney, David Ferry, David Della Rocco, Peter Fonda, Billy Connolly",Action,2297
The Box,https://en.wikipedia.org/wiki/The_Box_(2009_film),2009,Richard Kelly,"Cameron Diaz, James Marsden, Frank Langella, James Rebhorn, Holmes Osborne, Gillian Jacobs",Science fiction,2298
Bride Wars,https://en.wikipedia.org/wiki/Bride_Wars,2009,Gary Winick,"Kate Hudson, Anne Hathaway, Candice Bergen",Comedy,2299
Brothers,https://en.wikipedia.org/wiki/Brothers_(2009_film),2009,Jim Sheridan,"Tobey Maguire, Jake Gyllenhaal, Natalie Portman, Sam Shepard",War,2300
The Brothers Bloom,https://en.wikipedia.org/wiki/The_Brothers_Bloom,2009,Rian Johnson,"Adrien Brody, Mark Ruffalo, Rachel Weisz, Rinko Kikuchi, Robbie Coltrane, Maximilian Schell","Comedy, Crime",2301
Brother's War,https://en.wikipedia.org/w/index.php?title=Brother%27s_War&action=edit&redlink=1,2009,Jerry Buteyn,"Tino Struckmann, Michael Berryman",War,2302
Brothers at War,https://en.wikipedia.org/wiki/Brothers_at_War,2009,Jake Rademacher,Soldiers in the Iraq War,Documentary,2303
Brüno,https://en.wikipedia.org/wiki/Br%C3%BCno,2009,Larry Charles,Sacha Baron Cohen,Mockumentary,2304
 C Me Dance,https://en.wikipedia.org/wiki/C_Me_Dance,2009,Greg Robbins,"Greg Robbins, Christina DeMarco, Laura Romeo, Peter Kent",Thriller,2305
Capitalism: A Love Story,https://en.wikipedia.org/wiki/Capitalism:_A_Love_Story,2009,Michael Moore,The financial crisis of 2007–2010,Documentary,2306
Carriers,https://en.wikipedia.org/wiki/Carriers_(film),2009,"Alex Pastor, David Pastor","Lou Taylor Pucci, Chris Pine, Piper Perabo, Emily VanCamp, Christopher Meloni",Horror,2307
The Chaos Experiment,https://en.wikipedia.org/wiki/The_Chaos_Experiment,2009,Philippe Martinez,"Val Kilmer, Armand Assante, Eric Roberts",Drama,2308
A Christmas Carol,https://en.wikipedia.org/wiki/A_Christmas_Carol_(2009_film),2009,Robert Zemeckis,"Jim Carrey, Gary Oldman, Cary Elwes, Colin Firth",Animation,2309
Cirque du Freak: The Vampire's Assistant,https://en.wikipedia.org/wiki/Cirque_du_Freak:_The_Vampire%27s_Assistant,2009,Paul Weitz,"John C. Reilly, Ken Watanabe, Josh Hutcherson, Chris Massoglia, Michael Cerveris, Ray Stevenson, Patrick Fugit, Willem Dafoe, Salma Hayek",Fantasy,2310
Cloudy with a Chance of Meatballs,https://en.wikipedia.org/wiki/Cloudy_with_a_Chance_of_Meatballs_(film),2009,"Phil Lord, Chris Miller","Bill Hader, Anna Faris, James Caan, Andy Samberg, Bruce Campbell, Mr. T, Bobb'e J. Thompson, Benjamin Bratt, Neil Patrick Harris, Al Roker, Lauren Graham, Will Forte",Animated,2311
Cold Souls,https://en.wikipedia.org/wiki/Cold_Souls,2009,Sophie Barthes,"Paul Giamatti, Emily Watson, David Strathairn, Dina Korzun",Comedy,2312
The Collector,https://en.wikipedia.org/wiki/The_Collector_(2009_film),2009,Marcus Dunstan,"Josh Stewart, Michael Reilly Burke, Andrea Roth, Juan Fernández",Horror,2313
Confessions of a Shopaholic,https://en.wikipedia.org/wiki/Confessions_of_a_Shopaholic_(film),2009,P. J. Hogan,"Isla Fisher, Hugh Dancy, Joan Cusack, John Goodman, John Lithgow, Kristin Scott Thomas, Leslie Bibb",Romantic comedy,2314
Coraline,https://en.wikipedia.org/wiki/Coraline_(film),2009,Henry Selick,"Dakota Fanning, Teri Hatcher, Ian McShane, Jennifer Saunders, Dawn French",Animated,2315
Couples Retreat,https://en.wikipedia.org/wiki/Couples_Retreat,2009,Peter Billingsley,"Vince Vaughn, Jon Favreau, Jason Bateman, Faizon Love, Kristin Davis, Malin Åkerman, Kristen Bell, Kali Hawk, Jean Reno",Comedy,2316
The Cove,https://en.wikipedia.org/wiki/The_Cove_(film),2009,Louie Psihoyos,"The annual killing of dolphins at Taiji, Wakayama",Documentary,2317
Crank: High Voltage,https://en.wikipedia.org/wiki/Crank:_High_Voltage,2009,"Mark Neveldine, Brian Taylor","Jason Statham, Amy Smart, Clifton Collins, Jr., Efren Ramirez, Dwight Yoakam, Reno Wilson, Bai Ling, David Carradine",Action,2318
Crazy Heart,https://en.wikipedia.org/wiki/Crazy_Heart,2009,Scott Cooper,"Jeff Bridges, Maggie Gyllenhaal, Robert Duvall, Colin Farrell","Drama, Musical",2319
The Cross,https://en.wikipedia.org/wiki/The_Cross_(2009_film),2009,Matthew Crouch,Arthur Blessitt,Documentary,2320
Crossing Over,https://en.wikipedia.org/wiki/Crossing_Over_(film),2009,Wayne Kramer,"Harrison Ford, Sean Penn, Jim Sturgess, Ashley Judd, Alice Eve, Alice Braga, Cliff Curtis, Summer Bishil, Ray Liotta",Drama,2321
 Dance Flick,https://en.wikipedia.org/wiki/Dance_Flick,2009,Damien Dante Wayans,"Shoshana Bush, Damon Wayans, Jr.","Dance, Parody",2322
Did You Hear About the Morgans?,https://en.wikipedia.org/wiki/Did_You_Hear_About_the_Morgans%3F,2009,Marc Lawrence,"Hugh Grant, Sarah Jessica Parker, Sam Elliott, Mary Steenburgen, Elisabeth Moss, Wilford Brimley, Michael Kelly",Comedy,2323
District 9,https://en.wikipedia.org/wiki/District_9,2009,Neill Blomkamp,"Sharlto Copley, Jason Cope, David James",Science fiction,2324
Drag Me to Hell,https://en.wikipedia.org/wiki/Drag_Me_to_Hell,2009,Sam Raimi,"Alison Lohman, Justin Long, Lorna Raver, Dileep Rao, David Paymer, Adriana Barraza",Horror,2325
Dragonball Evolution,https://en.wikipedia.org/wiki/Dragonball_Evolution,2009,James Wong,"Justin Chatwin, Emmy Rossum, Joon Park, Chow Yun-fat, James Marsters, Eriko Tamura, Jamie Chung, Randall Duk Kim","Action, Fantasy",2326
Duplicity,https://en.wikipedia.org/wiki/Duplicity_(film),2009,Tony Gilroy,"Julia Roberts, Clive Owen, Tom Wilkinson, Paul Giamatti",Crime,2327
 Echelon Conspiracy,https://en.wikipedia.org/wiki/Echelon_Conspiracy,2009,Greg Marcks,"Shane West, Edward Burns, Ving Rhames, Jonathan Pryce, Tamara Feldman",Action,2328
Every Little Step,https://en.wikipedia.org/wiki/Every_Little_Step_(film),2009,"James D. Stern, Adam Del Deo",The casting of the 2006 Broadway revival of A Chorus Line,Documentary,2329
Everybody's Fine,https://en.wikipedia.org/wiki/Everybody%27s_Fine_(2009_film),2009,Nick Jones,"Robert De Niro, Drew Barrymore, Kate Beckinsale, Sam Rockwell",Drama,2330
Extract,https://en.wikipedia.org/wiki/Extract_(film),2009,Mike Judge,"Jason Bateman, Mila Kunis, Kristen Wiig, J. K. Simmons, Ben Affleck",Comedy,2331
 Fame,https://en.wikipedia.org/wiki/Fame_(2009_film),2009,Kevin Tancharoen,"Debbie Allen, Charles S. Dutton, Kelsey Grammer, Megan Mullally, Bebe Neuwirth, Asher Book, Kristy Flores, Paul Iacono, Paul McGill, Naturi Naughton, Kay Panabaker, Kherington Payne, Collins Pennie, Walter Perez, Anna Maria Perez de Taglé","Drama, Musical",2332
Fantastic Mr. Fox,https://en.wikipedia.org/wiki/Fantastic_Mr._Fox_(film),2009,Wes Anderson,"George Clooney, Meryl Streep, Cate Blanchett, Anjelica Huston",Animated film,2333
Fast & Furious,https://en.wikipedia.org/wiki/Fast_%26_Furious_(2009_film),2009,Justin Lin,"Vin Diesel, Paul Walker, Michelle Rodriguez, Jordana Brewster",Action,2334
Fighting,https://en.wikipedia.org/wiki/Fighting_(2009_film),2009,Dito Montiel,"Channing Tatum, Terrence Howard",Action,2335
The Final Destination,https://en.wikipedia.org/wiki/The_Final_Destination,2009,David R. Ellis,"Bobby Campo, Shantel VanSanten, Haley Webb, Nick Zano, Mykelti Williamson",Horror,2336
Fired Up!,https://en.wikipedia.org/wiki/Fired_Up!,2009,Will Gluck,"Nick D'Agosto, Eric Christian Olsen, Sarah Roemer, AnnaLynne McCord, Molly Sims, John Michael Higgins","Comedy, Teen",2337
"Food, Inc.","https://en.wikipedia.org/wiki/Food,_Inc.",2009,Robert Kenner,Agricultural food production in United States,Documentary,2338
